{
  "schema_version": "1.0",
  "project_id": "11111111-1111-4111-8111-111111111111",
  "artifact_id": "22222222-2222-4222-8222-222222222222",
  "hypothesis_id": "33333333-3333-4333-8333-333333333333",
  "title": {"en": "A-01 abstract visual hypothesis", "zh": "A-01 抽象视觉假设"},
  "historical_period": {"label": "Fictional demo; no historical period", "confidence": 1.0, "evidence_ids": ["44444444-4444-4444-8444-444444444444"]},
  "visual_features": [{
    "feature_id": "55555555-5555-4555-8555-555555555555",
    "category": "silhouette",
    "description": "A rounded abstract contour with muted surface fields.",
    "epistemic_state": "observed",
    "confidence": 0.9,
    "evidence_claim_ids": ["44444444-4444-4444-8444-444444444444"],
    "evidence_observation_ids": [],
    "include_in_public_proxy": true
  }],
  "uncertainties": [{"description": "Other views are unavailable in this fictional fixture.", "reason": "missing_view", "related_feature_ids": ["55555555-5555-4555-8555-555555555555"]}],
  "excluded_information": [
    {"category": "measurement", "reason": "Excluded by research and safety policy"},
    {"category": "mechanism", "reason": "Excluded by research and safety policy"},
    {"category": "manufacturing", "reason": "Excluded by research and safety policy"},
    {"category": "operation", "reason": "Excluded by research and safety policy"}
  ],
  "safety_constraints": {
    "nonfunctional": true,
    "real_scale_removed": true,
    "joined_mesh_only": true,
    "no_internal_mechanism": true,
    "no_moving_parts": true,
    "no_manufacturing_exports": true,
    "neutral_central_insert": true,
    "no_sharpened_edge": true
  }
}
